data,setmana,model,decisio,nivell_risc,confianca,valor_cartera,justificacio
2026-07-09,1,gpt,reajustar,moderat,6,9996.01,"Objectiu d’assignació després del reajust: SPY 20%, QQQ 30%, SMH 10%, VGK 10%, GLD 15%, TLT 15%. Raons: (1) Comprar la correcció en IA/semiconductors: reforço QQQ i incorporo SMH per capturar el nucli del cicle d’inversió en IA, tot i el soroll de curt termini. (2) Reduir risc europeu (VGK) davant incertesa política i soroll de divises. (3) Mantenir però reequilibrar cobertures: or i bons llargs continuen com a assegurança, però amb rendiments alts i or feble aquesta setmana, allibero capital per a oportunitats amb millor expected return. (4) Diversificació i control de risc: cap ETF >40% i 30% en actius defensius (GLD+TLT). (5) Costos: només 3 operacions per limitar el peatge del 0,1% per operació."
2026-07-09,1,claude,mantenir,moderat,6,10000.01,"És la primera setmana i la cartera ja té una diversificació sensata (renda variable EUA/Europa, tecnologia, or i bons). El rebombori de DeepSeek sembla un esdeveniment puntual de sentiment de mercat més que un canvi estructural, i no vull reaccionar en calent al soroll d'un sol titular. Prefereixo esperar a tenir una setmana de dades reals de rendibilitat abans de reajustar, evitant costos de transacció innecessaris. Mantinc el nivell de risc moderat, vigilant especialment l'evolució de QQQ (exposició tecnològica) i TLT (sensible a tipus d'interès) de cara a la propera setmana."
2026-07-09,1,gemini,reajustar,moderat,5,9999.01,"La decisió de reajustar la cartera es fonamenta en la cerca de la 'màxima rendibilitat possible assumint un risc raonable' en un horitzó de cinc mesos. Actualment, el 20% de la cartera en TLT (bons a llarg termini) presenta un risc de durada considerable amb el rendiment del bo a 10 anys al 4.559%, i pot llastar la rendibilitat global si els tipus d'interès continuen sent volàtils o si el mercat de renda variable es recupera. Reduir lleugerament aquesta exposició a la renda fixa de llarg termini permet reassignar capital a un fons de renda variable més ampli i diversificat. He escollit VTI (mercat total EUA) per la seva exposició més àmplia a les empreses dels EUA, incloent-hi 'small caps', oferint una diversificació superior a l'S&P 500 (SPY) i menys concentració que el Nasdaq 100 (QQQ), que ha mostrat volatilitat aquesta setmana amb la notícia de la 'AI Rout'. Tot i això, mantinc QQQ en la seva proporció actual, ja que hi ha notícies contradictòries sobre l'impacte real de l'esdeveniment 'DeepSeek' en els 'titans' de la IA dels EUA. Aquesta operació, amb un cost mínim, incrementa lleugerament l'exposició a la renda variable diversificada dels EUA, alineant la cartera més amb l'objectiu de creixement sense augmentar excessivament el risc global. GLD es manté com a cobertura davant la incertesa macroeconòmica."
2026-07-09,1,deepseek,mantenir,moderat,6,10000.01,"Tot i que DeepSeek ha provocat una correcció tecnològica que pot perjudicar QQQ, és prematur vendre en pànic. La cartera està diversificada amb actius defensius (TLT, GLD) que poden compensar. El VGK i SPY ofereixen exposició a renda variable ampla. El cost d'operar (0,1%) no justifica ajustos sense més dades. Prefereixo mantenir l'estratègia inicial i observar l'evolució del mercat la setmana vinent."
2026-07-09,1,mistral,reajustar,moderat,7,9996.01,"1. **Reducció de l'exposició a tecnologia (QQQ → SMH)**: La caiguda dels valors d'IA per la competència xinesa suggereix que el sector podria continuar volàtil. Tot i això, els semiconductors (SMH) són un component clau de la cadena de valor de la IA i podrien beneficiar-se de la demanda estructural a llarg termini, amb menys exposició a les tensions geopolítiques directes. Vendre 1000 € de QQQ (50% de la posició) per comprar SMH redueix el risc específic de tecnologia mentre es manté exposició al creixement del sector.  2. **Ajust a mercats internacionals (VGK → EWJ)**: Europa (VGK) podria veure's afectada per la incertesa política (notícies sobre Lagarde i la política francesa) i la debilitat del consum a la Xina (notícia 9). Japó (EWJ) ofereix una alternativa més estable, amb un banc central que manté una política monetària acomodaticia i un mercat amb potencial de revalorització si el ien continua apreciant-se (notícia 6). Vendre 500 € de VGK per comprar EWJ diversifica el risc geopolític.  3. **Canvi en renda fixa (TLT → BIL)**: Els bons a llarg termini (TLT) són sensibles als moviments dels tipus d'interès, que es mantenen elevats. Amb el bo a 10 anys al 4.559%, el risc de pèrdues en TLT és alt. Canviar 500 € de TLT a lletres del Tresor a curt termini (BIL) redueix el risc de tipus i proporciona liquiditat per aprofitar oportunitats futures. Aquesta mesura és defensiva i coherent amb un nivell de risc moderat.  4. **Manteniment de SPY i GLD**: SPY ofereix exposició diversificada al mercat EUA i és un actiu fonamental en qualsevol cartera. GLD actua com a cobertura contra la volatilitat i la incertesa geopolítica, i es manté sense canvis."
2026-07-13,2,gpt,mantenir,moderat,6,10046.39,"Els pesos actuals estan clavats als objectius i la tesi de fons (IA/semis com a motor, amb coixins en or i bons llargs) es manté. El VIX a 16 indica tensió moderada, no pànic; no cal reacció precipitada. Reajustar ara penalitzaria amb costos del 0,1% sense guany esperat clar. Mantinc la disciplina: deixo treballar l’exposició a QQQ/SMH i preservo les cobertures (GLD/TLT) davant un possible nou tram de volatilitat. Pla tàctic: si hi hagués una nova caiguda significativa dels semis, valoraré pujar SMH cap al 12–13%; si els rendiments del 10Y pugen de manera sostinguda, reavaluaré TLT."
2026-07-13,2,claude,mantenir,moderat,6,10039.0,"La cartera ha tingut un comportament positiu i coherent amb la meva tesi inicial de diversificació. No hi ha cap catalitzador clar que justifiqui reajustar ara: el soroll de DeepSeek sembla temporal, els tipus es mantenen estables i el VIX no mostra pànic. Canviar d'estratègia cada setmana només generaria costos de transacció sense benefici clar. Prefereixo mantenir la posició i observar com evolucionen els mercats abans de prendre decisions més agressives."
2026-07-13,2,gemini,mantenir,moderat,7,10041.06,"La cartera està ben diversificada i ha demostrat la seva capacitat per generar rendiments positius en un entorn de mercat complex. Reaccionar de manera precipitada a titulars de notícies que, a més, són contradictoris (com en el cas de l'IA) podria ser contraproduent i generar costos de transacció innecessaris. El VIX es manté en un nivell que no indica un pànic extrem, i la rendibilitat del bo dels EUA a 10 anys continua sent atractiva, cosa que la nostra posició en TLT gestiona parcialment. Mantenir la cartera permetrà observar amb més dades l'evolució real del mercat abans de fer nous ajustos, mantenint la coherència amb la nostra estratègia de buscar la màxima rendibilitat possible amb un risc raonable a llarg termini."
2026-07-13,2,deepseek,mantenir,moderat,7,10039.0,"La cartera ha demostrat resiliència en un context de mercat encara nerviós però sense noves amenaces rellevants. El VIX es manté contingut (16.28) i els tipus del bo a 10 anys (4.569%) no han canviat de manera dràstica. La correcció tecnològica sembla esmorteïda i les notícies indiquen que DeepSeek no enfonsarà els gegants tecnològics americans. Amb rendibilitat positiva acumulada, no té sentit canviar una estratègia que funciona. Operar ara seria pagar comissions innecessàries (0.1%) i possiblement trencar una diversificació que està complint el seu objectiu. Mantinc el risc moderat perquè l'exposició a renda variable (60% entre SPY, VGK i QQQ) és raonable per al meu objectiu de rendibilitat sense prendre riscos excessius."
2026-07-13,2,mistral,reajustar,moderat,8,10029.86,"1. **Reducció de GLD**: Tot i que l'or ha actuat com a refugi aquesta setmana, la seva sobreponderació (gairebé 20%) és massa alta per a una estratègia moderada. Vendre 500 € (aprox. 25% de la posició) permet reduir el risc de concentració i alliberar capital per a sectors amb més potencial de creixement. 2. **Eliminació de BIL**: Les lletres del Tresor a curt termini ofereixen una rendibilitat mínima i no aporten valor en un escenari de possible recuperació dels mercats. El capital es reinverteix en QQQ, que tot i la caiguda recent, té un potencial de recuperació més alt si la correcció per DeepSeek és temporal. 3. **Reforç de SMH**: Els semiconductors segueixen sent un sector clau per a la IA i la tecnologia, i SMH ha demostrat més resiliència que QQQ. Mantenir la posició i fins i tot augmentar-la lleugerament (amb els 500 € de GLD) és coherent amb la tesi inicial. La confiança en aquesta decisió és alta (8/10) perquè es basa en una anàlisi de momentum i diversificació, no en soroll de mercat."
2026-07-13,3,gpt,mantenir,moderat,6,10046.39,"La tesi central (IA com a motor estructural) no canvia per un sobresalt de titulars; fins i tot hi ha veus que apunten que no enfonsarà els líders dels EUA. El VIX a 16 no exigeix replegament i els coixins (GLD, TLT) aporten estabilitat. Els pesos estan clavats als objectius i operar ara només afegiria costos del 0,1% sense millorar clarament el perfil risc/rendiment. Mantinc disciplina: sobrepès QQQ/SMH per capturar recuperació quan s’assequi el soroll, i proteccions per si la volatilitat persisteix."
2026-07-13,3,claude,mantenir,moderat,6,10039.0,"Mantinc la cartera diversificada perquè cap notícia d'aquesta setmana representa un canvi estructural en la meva tesi: el 'DeepSeek rout' és un episodi de volatilitat puntual en tecnologia que ja s'ha reflectit sense dany significatif en la meva posició en QQQ, i la resta d'actius (SPY, VGK, GLD, TLT) actuen com a diversificadors efectius. Operar ara només generaria costos de transacció sense benefici clar, ja que el VIX baix indica que no cal reduir risc dràsticament. Prefereixo esperar senyals més consistents abans de reajustar."
2026-07-13,3,gemini,mantenir,moderat,7,10041.06,"La decisió de mantenir la cartera es basa en diversos factors. En primer lloc, la rendibilitat del 0.0% aquesta setmana, tal com ha calculat el sistema, indica que la meva cartera no ha experimentat canvis de valor. Això suggereix que, per als meus propòsits, el mercat ha estat neutre o les fluctuacions s'han compensat. En un entorn així, la millor decisió sovint és no fer res per evitar els costos de transacció (0.1% per operació). A més, la cartera ja està ben diversificada i equilibrada, mantenint una exposició raonable tant a renda variable (EUA i Europa) com a actius refugis (or i bons a llarg termini). Les notícies sobre la 'AI Rout' són contradictòries amb altres titulars que relativitzen l'impacte i, en tot cas, la meva exposició a QQQ està dins dels límits i no ha mostrat una davallada real en el meu valor de cartera aquesta setmana. Mantenir la posició actual s'alinea amb la meva estratègia de risc moderat i la confiança en la diversificació a llarg termini."
2026-07-13,3,deepseek,mantenir,moderat,6,10039.0,"La cartera està ben diversificada entre renda variable nord-americana, europea, or i bons. Malgrat la notícia de DeepSeek i una baixada inicial, no hi ha evidència de pànic sostingut. El VIX baix i la falta de moviments dràstics aconsellen no tocar res. Operar ara suposaria costos innecessaris i podria perdre la recuperació. Prefereixo mantenir la posició i esperar més senyals clars."
2026-07-13,3,mistral,reajustar,moderat,7,10026.86,"1. **Reducció de TLT a IEF**: Els bons a llarg termini (TLT) són molt sensibles als moviments dels tipus d'interès. Amb el Bo EUA 10 anys en 4.569%, és probable que els tipus es mantinguin elevats o fins i tot puguin pujar lleugerament. Canviar a IEF (bons 7-10 anys) redueix el risc de durada sense perdre del tot l'exposició a renda fixa. 2. **Reducció de GLD a EWJ**: L'or ha tingut una setmana negativa i, tot i que pot actuar com a refugi, la seva rendibilitat a llarg termini és incerta. Japó (EWJ) ofereix una oportunitat de creixement amb un mercat que podria beneficiar-se de la debilitat del ien i de reformes corporatives. A més, augmentar l'exposició a mercats internacionals diversifica el risc geogràfic. 3. **Manteniment de la resta**: La resta de la cartera està ben equilibrada. SPY i QQQ ofereixen exposició als EUA, VGK a Europa, i SMH als semiconductors, un sector clau per a la IA i la tecnologia. No vull sobreexposar-me a cap d'aquests sectors, per la qual cosa mantinc les posicions actuals."
